{
  "meta": {
    "placeholder": true,
    "title": "Pre-Revenue",
    "logline": "A laid-off product manager crashes an SF rooftop launch party pretending to be an AI founder, and has until the midnight lightning demo to make the lie real or get caught.",
    "genre": "satirical comedy",
    "rating": "PG-13",
    "target_runtime_min": 10,
    "beat_seconds": 120,
    "lock_seconds_before_end": 65
  },
  "world": {
    "place": "A rooftop launch party in SoMa, San Francisco, with a small stage for lightning demos",
    "time": "Present day, one night, from sunset to just after midnight",
    "tone": [
      "satirical",
      "fast",
      "cringe-funny",
      "warm underneath"
    ],
    "rules": [
      "No real companies, products, funds or real people are ever named; invent everything.",
      "Everyone speaks in startup jargon, and nobody admits they don't understand it.",
      "Nobody is ever physically hurt; stakes are social and financial.",
      "The lightning demo starts at midnight no matter what."
    ]
  },
  "moods": [
    "hype",
    "skeptical",
    "chaotic",
    "wholesome",
    "ruthless"
  ],
  "style": {
    "visual_prompt": "2D animated satirical comedy, bold clean outlines, flat vibrant colors, expressive cartoon characters, San Francisco rooftop party at night with string lights and fog",
    "camera": "Animated sitcom framing: medium shots, snappy push-ins on reactions, occasional glance to camera",
    "lighting": "Warm string lights and neon accents, laptop glow on faces, simple cel shading",
    "motion": "Snappy cartoon timing, exaggerated expressions, light camera drift",
    "negative_prompt": "photorealistic, live action, 3D render, text, logos, brand names, watermark, extra limbs, distorted faces",
    "aspect_ratio": "16:9",
    "clip_seconds": 6
  },
  "characters": [
    {
      "id": "rory",
      "name": "Rory Vance",
      "role": "protagonist",
      "want": "Get a term sheet tonight so he can make rent without admitting he was laid off",
      "secret": "His startup, an AI that negotiates with your houseplants, is one slide deck and a soil sensor taped to a fern",
      "voice": {
        "speech_style": "Overconfident buzzwords that crack into panic, talks fast, says 'we' about himself",
        "description": "Man, early 30s, American, quick nervous tenor"
      },
      "portrait_prompt": "Man in his early 30s, fleece vest over a button-down, lanyard, carrying a potted fern, nervous grin",
      "can_die_after_beat": null
    },
    {
      "id": "nadia",
      "name": "Nadia Okoro",
      "role": "wildcard",
      "want": "Find the next breakout company before her rivals do",
      "secret": "Her fund has one investment left before her partners shut it down",
      "voice": {
        "speech_style": "Calm, clipped, asks one devastating question at a time",
        "description": "Woman, 40s, British accent, low and unhurried"
      },
      "portrait_prompt": "Woman in her 40s, tailored black blazer, sneakers, sparkling water in hand, appraising stare",
      "can_die_after_beat": null
    },
    {
      "id": "theo",
      "name": "Theo Lindqvist",
      "role": "antagonist",
      "want": "Win the midnight demo slot and Nadia's money for his own startup",
      "secret": "Most of his startup's ten thousand users are bots he wrote",
      "voice": {
        "speech_style": "Smug, polished, laughs at his own jokes, name-drops imaginary billionaires",
        "description": "Man, late 20s, Scandinavian-American, smooth and bright"
      },
      "portrait_prompt": "Man in his late 20s, black turtleneck, AirPod-style earbuds, perfect hair, holding a branded water bottle with no logo",
      "can_die_after_beat": null
    },
    {
      "id": "jun",
      "name": "Jun Park",
      "role": "ally",
      "want": "Go home; he only came for the free dumplings",
      "secret": "He is a far better engineer than anyone on the roof, Rory included",
      "voice": {
        "speech_style": "Deadpan, one-liners, sighs before every sentence",
        "description": "Man, late 20s, Korean-American, flat and dry"
      },
      "portrait_prompt": "Man in his late 20s, hoodie, laptop covered in stickers with no logos, paper plate of dumplings",
      "can_die_after_beat": null
    }
  ],
  "opening": {
    "narration": "San Francisco. Sunset. Somewhere in SoMa, a rooftop full of people pretending to be busier than they are.",
    "lines": [
      {
        "speaker": "rory",
        "text": "Okay. You are a founder. Founders say 'we' and 'scale'."
      },
      {
        "speaker": "jun",
        "text": "You are holding a fern."
      },
      {
        "speaker": "rory",
        "text": "The fern is the product, Jun."
      }
    ],
    "shots": [
      {
        "frame": "San Francisco skyline at sunset, fog rolling in, a crowded rooftop party with string lights",
        "motion": "Slow aerial drift toward the rooftop",
        "sound": "City hum, distant party music, a cable car bell",
        "line": {
          "speaker": "narrator",
          "text": "A rooftop full of people pretending to be busier than they are."
        }
      },
      {
        "frame": "Rory in an elevator mirror, adjusting a name tag that reads Founder, holding a potted fern",
        "motion": "Slow push-in as he practices a confident smile",
        "characters": [
          "rory"
        ],
        "sound": "Elevator hum, a soft ding",
        "line": {
          "speaker": "rory",
          "text": "Okay. You are a founder. Founders say 'we' and 'scale'."
        }
      },
      {
        "frame": "Jun beside Rory in the elevator, deadpan, holding a paper plate of dumplings",
        "motion": "Jun turns his head slowly to look at the fern",
        "characters": [
          "jun",
          "rory"
        ],
        "sound": "Elevator doors opening onto party noise",
        "line": {
          "speaker": "jun",
          "text": "You are holding a fern."
        }
      }
    ]
  },
  "beats": [
    {
      "id": "beat_pitch",
      "act": 1,
      "purpose": "Rory's lie gets an audience it should never have had",
      "must_hit": "Nadia overhears Rory's fake pitch and books him for the midnight lightning demo",
      "flexible": [
        "How absurd the pitch gets",
        "Which buzzwords he uses",
        "Whether Jun plays along as CTO"
      ],
      "max_words": 220,
      "shots": [
        {
          "frame": "Rory at a high-top table pitching to strangers, fern on the table",
          "motion": "Handheld push-in as he gestures wildly",
          "characters": [
            "rory"
          ],
          "sound": "Party chatter, clinking glasses",
          "line": {
            "speaker": "rory",
            "text": "We're building agentic infrastructure for plants. Plants are the last untapped user base."
          }
        },
        {
          "frame": "Nadia behind Rory, lowering her sparkling water, eyebrow raised",
          "motion": "Rack focus from Rory to Nadia",
          "characters": [
            "nadia"
          ],
          "sound": "Chatter drops away",
          "line": {
            "speaker": "nadia",
            "text": "Midnight. Lightning demo. Show me the fern negotiating."
          }
        }
      ]
    },
    {
      "id": "beat_rival",
      "act": 2,
      "purpose": "The lie gets a witness who wants it to fail",
      "must_hit": "Theo recognizes Rory and makes clear he knows Rory was laid off",
      "flexible": [
        "Whether Rory bluffs, bribes or begs",
        "Who overhears",
        "What Theo demands in exchange for silence"
      ],
      "max_words": 220,
      "shots": [
        {
          "frame": "Theo appearing at Rory's shoulder with a smug grin, turtleneck, water bottle",
          "motion": "Theo leans into frame as Rory freezes",
          "characters": [
            "theo",
            "rory"
          ],
          "sound": "A DJ transition, a laugh nearby",
          "line": {
            "speaker": "theo",
            "text": "Rory! Didn't your whole team get laid off in March?"
          }
        }
      ]
    },
    {
      "id": "beat_build",
      "act": 2,
      "purpose": "The lie tries to become real",
      "must_hit": "Jun builds something that technically works in thirty minutes, held together with tape",
      "flexible": [
        "What the demo actually does",
        "Where they hide to build it",
        "Who helps or sabotages"
      ],
      "max_words": 220,
      "shots": [
        {
          "frame": "Jun typing furiously on a laptop in a cramped rooftop storage room, fern wired to a tiny circuit board",
          "motion": "Quick push-in on the screen glow on his face",
          "characters": [
            "jun"
          ],
          "sound": "Fast keyboard clatter, muffled party bass through the wall",
          "line": {
            "speaker": "jun",
            "text": "It works. Do not breathe on it."
          }
        }
      ]
    },
    {
      "id": "beat_stage",
      "act": 3,
      "purpose": "The lie meets an audience",
      "must_hit": "Rory starts the lightning demo on stage and something goes wrong live",
      "flexible": [
        "What breaks",
        "How Rory improvises",
        "What Theo does from the crowd"
      ],
      "max_words": 220,
      "shots": [
        {
          "frame": "Rory on a small stage under a projector, fern on a stool beside him, crowd holding up phones",
          "motion": "Slow push-in as the projector flickers",
          "characters": [
            "rory"
          ],
          "sound": "Mic feedback, crowd murmur",
          "line": {
            "speaker": "rory",
            "text": "Ladies and gentlemen. The fern will now negotiate its own water."
          }
        }
      ]
    },
    {
      "id": "beat_resolution",
      "act": 3,
      "purpose": "Land the chosen ending",